{
    "$schema": "http://json-schema.org/draft-07/schema#",
    "$id": "https://eks.engineering/schemas/eks_asset_setup_schema.json",
    "version": "1.4.0",
    "title": "EKS Asset Setup Schema — Registry & Column Normalization",
    "description": "Declares the asset_type_registry (type→fragment mapping including conditional_fragments for zero-code extensibility) and column normalization rules for ingesting the project Excel datadrop. 14 fragments (13 pre-existing + asset_context for explicit relationship and location/system hierarchy context).",
    "allOf": [
        { "$ref": "eks_asset_base_schema.json" }
    ],
    "type": "object",
    "definitions": {
        "fragment_name": {
            "type": "string",
            "enum": [
                "item_core",
                "process_conditions",
                "manufacturer",
                "asset_lifecycle",
                "control_system",
                "piping_connection",
                "valve_internals",
                "actuator",
                "rotating_equipment",
                "instrumentation",
                "pipeline_route",
                "specialist_equipment",
                "motor_control",
                "asset_context"
            ]
        },
        "conditional_fragment_rule": {
            "type": "object",
            "description": "A rule that applies a fragment only when a specified field value matches a set of values",
            "properties": {
                "fragment": { "$ref": "#/definitions/fragment_name" },
                "when":     { "type": "string", "description": "Field name in item_core to evaluate" },
                "in":       { "type": "array", "items": { "type": "string" }, "minItems": 1, "description": "List of values that trigger the fragment" }
            },
            "required": ["fragment", "when", "in"],
            "additionalProperties": false
        }
    },
    "properties": {
        "$schema":     { "type": "string" },
        "$id":         { "type": "string" },
        "version":     { "type": "string" },
        "title":       { "type": "string" },
        "description": { "type": "string" },
        "relationship_triggers": {
            "type": "object",
            "description": "Maps asset config fields to graph relationship types for auto-creating edges at ingest",
            "additionalProperties": { "type": "string" }
        },
        "document_triggers": {
            "$ref": "https://eks.engineering/schemas/eks_base_schema.json#/definitions/document_relationship_trigger_map",
            "description": "Maps document registry fields to graph relationship types for doc-asset linking at ingest (shared SSOT with doc config)"
        },
        "asset_type_registry": {
            "type": "object",
            "description": "Maps each AT_ tag_type to its fragment list and optional conditional fragment rules. Adding a new asset type requires only a new entry here — no code changes.",
            "additionalProperties": {
                "type": "object",
                "properties": {
                    "label": { "type": "string" },
                    "fragments": {
                        "type": "array",
                        "items": { "$ref": "#/definitions/fragment_name" },
                        "minItems": 2
                    },
                    "conditional_fragments": {
                        "type": "array",
                        "description": "Optional rules to include additional fragments based on field values at ingest time",
                        "items": { "$ref": "#/definitions/conditional_fragment_rule" }
                    }
                },
                "required": ["label", "fragments"],
                "additionalProperties": false
            }
        },
        "ontology_class_map": {
            "type": "object",
            "description": "Maps AT_ tag types to ontology class names for dynamic A-Box creation.",
            "additionalProperties": { "type": "string" }
        },
        "fragment_category_registry": {
            "type": "object",
            "description": "Categorizes each fragment as functional (slot/design) or physical (equipment instance) per ISO 15926 Part 2.",
            "additionalProperties": {
                "type": "string",
                "enum": ["functional", "physical"]
            }
        },
        "column_normalization": {
            "type": "object",
            "description": "Maps sheet-specific column names to canonical field names per sheet",
            "additionalProperties": {
                "type": "object",
                "additionalProperties": { "type": "string" }
            }
        },
        "sheet_registry": {
            "type": "array",
            "description": "Registered sheet names referenced by asset_column_normalization.asset_type_code (I316/Q1 — lookup table asset_sheet source).",
            "items": {
                "type": "object",
                "properties": {
                    "sheet_name": { "type": "string" }
                },
                "required": ["sheet_name"],
                "additionalProperties": false
            },
            "minItems": 1
        },
        "trigger_scope_registry": {
            "type": "array",
            "description": "Registered trigger scopes (relationship_triggers, document_triggers) referenced by asset_trigger.asset_type_code (I316/Q1 — lookup table asset_trigger_scope source).",
            "items": {
                "type": "object",
                "properties": {
                    "scope_name": { "type": "string" }
                },
                "required": ["scope_name"],
                "additionalProperties": false
            },
            "minItems": 1
        }
    },
    "required": ["asset_type_registry", "column_normalization", "sheet_registry", "trigger_scope_registry"],
    "additionalProperties": false
}
