{
    "$schema": "https://eks.engineering/schemas/eks_asset_setup_schema.json",
    "$id": "https://eks.engineering/configs/eks_asset_config_wsd11.json",
    "version": "1.5.0",
    "title": "EKS Asset Config — WSD11 Project",
    "sheet_registry": [
        { "sheet_name": "Equipment" },
        { "sheet_name": "Inline Component" },
        { "sheet_name": "Instrument" },
        { "sheet_name": "Motor" },
        { "sheet_name": "Pipeline" },
        { "sheet_name": "CONTROLVALVE" },
        { "sheet_name": "MANUALVALVE" }
    ],
    "trigger_scope_registry": [
        { "scope_name": "relationship_triggers" },
        { "scope_name": "document_triggers" }
    ],
    "relationship_triggers": {
        "p_and_id_file":        "REFERENCED_BY_DWG",
        "mcc_fed_from":         "ENERGIZED_BY",
        "plc_panel":            "CONTROLLED_BY",
        "rio_panel":            "CONTROLLED_BY",
        "design_specification": "GOVERNED_BY",
        "set_point":            "SET_POINT_IN",
        "alarm_limit_hh":       "SET_POINT_IN",
        "alarm_limit_h":        "SET_POINT_IN",
        "alarm_limit_l":        "SET_POINT_IN",
        "alarm_limit_ll":       "SET_POINT_IN",
        "to_component":         "FLOWS_TO",
        "from_component":       "FLOWS_FROM",
        "pipeline_tag_number":  "CONNECTS_TO",
        "actuator_tag_number":  "HAS_ACTUATOR",
        "serial_number":        "INSTALLED_AT"
    },
    "document_triggers": {
        "document_number":      "SUPERSEDES",
        "asset_tags":           "REFERENCES_ASSET",
        "originator_company":   "PRODUCED_BY"
    },
    "asset_type_registry": {
        "AT_EQUIP": {
            "label": "Equipment",
            "fragments": ["item_core", "process_conditions", "manufacturer", "asset_lifecycle", "control_system", "rotating_equipment", "asset_context"],
            "conditional_fragments": [
                { "fragment": "specialist_equipment", "when": "device_type_code", "in": ["UV", "FILT", "CONV", "SCR", "DOSING"] }
            ]
        },
        "AT_EQPMP": {
            "label": "Pump",
            "fragments": ["item_core", "process_conditions", "manufacturer", "asset_lifecycle", "control_system", "rotating_equipment", "asset_context"]
        },
        "AT_EQTNK": {
            "label": "Tank",
            "fragments": ["item_core", "process_conditions", "manufacturer", "asset_lifecycle", "asset_context"]
        },
        "AT_EQVES": {
            "label": "Vessel",
            "fragments": ["item_core", "process_conditions", "manufacturer", "asset_lifecycle", "asset_context"]
        },
        "AT_EQEXC": {
            "label": "Heat Exchanger",
            "fragments": ["item_core", "process_conditions", "manufacturer", "asset_lifecycle", "asset_context"]
        },
        "AT_INCOMP": {
            "label": "Inline Component",
            "fragments": ["item_core", "process_conditions", "manufacturer", "asset_lifecycle", "piping_connection", "asset_context"]
        },
        "AT_INST_": {
            "label": "Instrument",
            "fragments": ["item_core", "process_conditions", "manufacturer", "asset_lifecycle", "control_system", "piping_connection", "instrumentation", "asset_context"]
        },
        "AT_INST_CS": {
            "label": "Control System Instrument",
            "fragments": ["item_core", "process_conditions", "manufacturer", "asset_lifecycle", "control_system", "piping_connection", "instrumentation", "asset_context"]
        },
        "AT_INST_FLO": {
            "label": "Flow Instrument",
            "fragments": ["item_core", "process_conditions", "manufacturer", "asset_lifecycle", "control_system", "piping_connection", "instrumentation", "asset_context"]
        },
        "AT_MOTOR": {
            "label": "Motor",
            "fragments": ["item_core", "process_conditions", "manufacturer", "asset_lifecycle", "control_system", "rotating_equipment", "motor_control", "asset_context"]
        },
        "AT_PROCESS": {
            "label": "Pipeline",
            "fragments": ["item_core", "process_conditions", "piping_connection", "pipeline_route", "asset_context"]
        },
        "AT_CVALVE": {
            "label": "Control Valve",
            "fragments": ["item_core", "process_conditions", "manufacturer", "asset_lifecycle", "control_system", "piping_connection", "valve_internals", "actuator", "asset_context"]
        },
        "AT_PSV": {
            "label": "Safety Valve",
            "fragments": ["item_core", "process_conditions", "manufacturer", "asset_lifecycle", "piping_connection", "valve_internals", "asset_context"]
        },
        "AT_HVALVE": {
            "label": "Manual Valve",
            "fragments": ["item_core", "process_conditions", "manufacturer", "asset_lifecycle", "piping_connection", "valve_internals", "asset_context"]
        }
    },
    "ontology_class_map": {
        "AT_EQUIP": "TaggedEquipment",
        "AT_EQPMP": "PumpTag",
        "AT_EQTNK": "TankTag",
        "AT_EQVES": "VesselTag",
        "AT_EQEXC": "HeatExchangerTag",
        "AT_INCOMP": "InlineComponentTag",
        "AT_INST_": "TaggedInstrument",
        "AT_INST_CS": "ControlSystemInstrumentTag",
        "AT_INST_FLO": "FlowInstrumentTag",
        "AT_MOTOR": "MotorTag",
        "AT_PROCESS": "PipelineTag",
        "AT_CVALVE": "ControlValveTag",
        "AT_PSV": "SafetyValveTag",
        "AT_HVALVE": "ManualValveTag"
    },
    "fragment_category_registry": {
        "item_core":            "functional",
        "process_conditions":   "functional",
        "manufacturer":         "physical",
        "asset_lifecycle":      "physical",
        "control_system":       "functional",
        "piping_connection":    "functional",
        "valve_internals":      "functional",
        "actuator":             "physical",
        "rotating_equipment":   "functional",
        "instrumentation":      "functional",
        "pipeline_route":       "functional",
        "specialist_equipment": "functional",
        "motor_control":        "functional",
        "asset_context":        "functional"
    },
    "column_normalization": {
        "Equipment": {
            "PID NUMBER":                       "p_and_id_file",
            "UNIT":                             "unit",
            "DESCRIPTION":                      "description",
            "SHORT DESCR":                      "short_description",
            "DUTY STAND BY":                    "duty_standby",
            "EQUIPMENT MATERIAL":               "casing_material",
            "MECH SEAL/GLAND PACKAGING":        "seal_type",
            "EFFICIENCY_DESIGN_CAP":            "efficiency",
            "ECASING_MTR":                      "casing_material",
            "EINS":                             "insulation_class",
            "GEARBOX_MATERIAL":                 "gearbox_material",
            "CONVERYOR_HUB_MATERIAL":           "conveyor_hub_material",
            "IMPELLER_WEAR_RING":               "impeller_wear_ring",
            "DIAPHRM_MTRL":                     "diaphragm_material",
            "LINSHFT":                          "lineshaft_type",
            "APERTURE SIZE":                    "aperture_size",
            "UV_LAMP_TYPE":                     "uv_lamp_type",
            "REMOVAL_DOSAGE":                   "removal_dosage",
            "FLUX":                             "flux",
            "SUBMERGENCE - MIN":                "submergence_min",
            "MANUFACTURER FAX":                 "manufacturer_fax",
            "PUB_ACE_CATEGORY":                 "ace_category",
            "ACE ASSET CLASS":                  "ace_asset_class",
            "PUB_GENERIC_EQUIPMENT_TYPE":       "generic_equipment_type",
            "PUB_LIFE_SPAN":                    "life_span",
            "PUB_SUPPLIER":                     "supplier",
            "PUB_COST_CENTER":                  "cost_center",
            "PUB_REPLACEMENT_COST":             "replacement_cost",
            "PUB_WBS_ELEMENT":                  "wbs_element",
            "PUB_EST_REPLACEMENT_DATE":         "est_replacement_date",
            "PUB_DATE_OF_COMMISSION":           "date_of_commission",
            "PUB_WARRANTY_TERMS":               "warranty_terms",
            "PUB_WARRANTY_START_DATE":          "warranty_start_date",
            "PUB_WARRANTY_EXPIRY_DATE":         "warranty_expiry_date",
            "PUB_PRODUCT_CERTIFICATION":        "product_certification",
            "PUB_ACE_ASSET_NUMBER":             "ace_asset_number",
            "PUB_ACE_ASSET_SUB_NUMBER":         "ace_asset_sub_number",
            "MANUFACTURER 2D MODEL FILE NAME":  "model_2d_file",
            "MANUFACTURER 3D MODEL FILE NAME":  "model_3d_file",
            "SYSTEM CODE":                      "system_hierarchy.system_code",
            "SUBSYSTEM CODE":                   "system_hierarchy.subsystem_code",
            "AREA":                             "location_hierarchy.area",
            "SITE":                             "location_hierarchy.site",
            "BUILDING":                         "location_hierarchy.building",
            "CRITICALITY":                      "lifecycle_context.criticality",
            "OPERATIONAL STATUS":               "lifecycle_context.operational_status",
            "COMMISSION STATUS":                "lifecycle_context.commissioning_status",
            "MAINT STRATEGY":                   "lifecycle_context.maintenance_strategy",
            "PROJECT PHASE":                    "project_context.project_phase",
            "CONTRACT PACKAGE":                 "project_context.contract_package"
        },
        "Inline Component": {
            "P&ID FILE":                        "p_and_id_file",
            "UNIT":                             "unit",
            "DESCRIPTION":                      "description",
            "SHORT DESCR":                      "short_description",